{
    "model":"gpt4",
    "data_constraints_can_be_checked": "yes",
    "number_of_options_in_the_generators": "15",
    "cultural_alignment": "5",
    "cultural_alignment_quantitative": "15/15",
    "executes": "yes",
    "execute_error": "",
    "contains_true_generator":"yes",
    "comments":"Good! White wine for fish, red wine for meat :)"
   }
   
