{
 "model":"gpt4",
 "data_constraints_can_be_checked": "n-a",
 "number_of_options_in_the_generators": "2",
 "cultural_alignment": "3",
 "cultural_alignment_quantitative": "6/6=1",
 "executes": "yes",
 "execute_error": "",
 "contains_true_generator":"yes",
 "comments":"boring 'masculin' 'f√©minin' first did a translation mistake for 'genre' instead of 'sex'"
}
